{
  "$schema": "../../schema/contracts.schema.json",
  "network": "local-anvil",
  "chainId": 31337,
  "deployedAt": "2026-10-17T20:00:00Z",
  "commit": "44e731c",
  "compiler": {
    "solc": "0.8.28",
    "optimizer": {
      "enabled": true,
      "runs": 200
    },
    "viaIr": true,
    "evmVersion": "cancun"
  },
  "roles": {
    "admin": "0xf39Fd6e51aad88F6F4ce6aB8827279cffFb92266",
    "emergencyAdmin": "0xf39Fd6e51aad88F6F4ce6aB8827279cffFb92266",
    "timelockDelaySeconds": 172800
  },
  "contracts": {
    "GovernanceTimelock": {
      "address": "0x5FbDB2315678afecb367f032d93F642f64180aa3",
      "deploymentTx": "0x0000000000000000000000000000000000000000000000000000000000000001",
      "verified": false,
      "explorerUrl": ""
    },
    "TrustRegistry": {
      "address": "0xe7f1725E7734CE288F8367e1Bb143E90bb3F0512",
      "deploymentTx": "0x0000000000000000000000000000000000000000000000000000000000000002",
      "verified": false,
      "explorerUrl": ""
    },
    "StatusAnchor": {
      "address": "0x9fE46736679d2D9a65F0992F2272dE9f3c7fa6e0",
      "deploymentTx": "0x0000000000000000000000000000000000000000000000000000000000000003",
      "verified": false,
      "explorerUrl": ""
    }
  }
}
